{
  "architecture": "aarch64",
  "argument_mode": "game-dir-and-passthrough",
  "enabled_quirks": [],
  "executable": "partyhard-nextos",
  "generation_runtime": [
    {
      "mode": "0755",
      "path": "partyhard-nextos",
      "role": "executable",
      "sha256": "bb3e448476db83c918dd6e8183c3f08fbecebe5055104134c5102968d8e9a8ff"
    },
    {
      "mode": "0644",
      "path": "nxextract/lib/aarch64/liblz4.so.1",
      "role": "private-library",
      "sha256": "a65c53e2e7015b636e4f212449eff2016b99736cdf5798fe2cf3672818b88b8b"
    },
    {
      "mode": "0644",
      "path": "adapter-env.sh",
      "role": "runtime-hook",
      "sha256": "7c148306307e821692c6a29ecd2effb77becb0595f59f3ccf44bffc4ea57aded"
    },
    {
      "mode": "0644",
      "path": "extractor.json",
      "role": "nxextract-recipe",
      "sha256": "616ddbccb8c055c4e99a13bb5d72fc1375f15c9a5f7c624a322ee6de87cd961b"
    },
    {
      "mode": "0644",
      "path": "nxextract/nxextract.py",
      "role": "nxextract-engine",
      "sha256": "e59a1e525ea475635c2e8f51bff3c6fff8cdaad406c158e3dad011cdd96876a7"
    },
    {
      "mode": "0644",
      "path": "nxextract/run-extractor.sh",
      "role": "nxextract-runner",
      "sha256": "583d046d4d95a2d15d66f0aee35911097698b34b0bd33732b2a517e6408bf9d0"
    },
    {
      "mode": "0644",
      "path": "nxextract/nxextract-runtime-env.sh",
      "role": "nxextract-runtime-env",
      "sha256": "332919a9960d4317563b647f9932d1a4367da147a425fe2f78eafd706f01563f"
    },
    {
      "mode": "0755",
      "path": "nxextract/nxextract-ui",
      "role": "nxextract-ui",
      "sha256": "8e4a68ae0a611096d23b04628b4f2e8b5cf34755fe9b71d134bc0d7ea6ccf987"
    },
    {
      "mode": "0644",
      "path": "nxextract/prepare_partyhard_data.py",
      "role": "nxextract-helper",
      "sha256": "c6ab36a7103eab6e33b2a53ea6529bc903c93ddf87bb26f85efae8a63da8e91a"
    },
    {
      "mode": "0644",
      "path": "nxextract/vendor/python/UnityPy/__init__.py",
      "role": "nxextract-helper",
      "sha256": "a4c543cf27b066bf8836276a6f70bc963c110f484a64836cbc8607629240eb61"
    },
    {
      "mode": "0644",
      "path": "nxextract/vendor/python/UnityPy/classes/ClassIDTypeToClassMap.py",
      "role": "nxextract-helper",
      "sha256": "fca4f8e2f2b62fc5065db69629baba1398a0f3f0fe25aed6eab826f2aeae938f"
    },
    {
      "mode": "0644",
      "path": "nxextract/vendor/python/UnityPy/classes/Object.py",
      "role": "nxextract-helper",
      "sha256": "b3f0c4f8e5b4db3aacdcaaa2f57c65272b4ac834f3a0beee357122c04b63ed4c"
    },
    {
      "mode": "0644",
      "path": "nxextract/vendor/python/UnityPy/classes/PPtr.py",
      "role": "nxextract-helper",
      "sha256": "221c795df92e9d338338944aa8049c53e553f0e232e11179a7d7d4ee6783f289"
    },
    {
      "mode": "0644",
      "path": "nxextract/vendor/python/UnityPy/classes/UnknownObject.py",
      "role": "nxextract-helper",
      "sha256": "875e5ddc8a7190bce675b3c2c0e2842d65ced9372759a61cc12452b067e49ba0"
    },
    {
      "mode": "0644",
      "path": "nxextract/vendor/python/UnityPy/classes/__init__.py",
      "role": "nxextract-helper",
      "sha256": "94dfe5f423f82a2cfa621f3a9f04295f79a951db368cb71c34df4bd8494ed6cf"
    },
    {
      "mode": "0644",
      "path": "nxextract/vendor/python/UnityPy/classes/generated.py",
      "role": "nxextract-helper",
      "sha256": "3ca5cded6e6bdc2ae1752fa7d59303d7b080789a8247a96907b5b22038308157"
    },
    {
      "mode": "0644",
      "path": "nxextract/vendor/python/UnityPy/classes/legacy_patch/Shader.py",
      "role": "nxextract-helper",
      "sha256": "2da3be0bd042bf9824650042352407f2df8b367655430879b6fdf239e8612dce"
    },
    {
      "mode": "0644",
      "path": "nxextract/vendor/python/UnityPy/classes/legacy_patch/__init__.py",
      "role": "nxextract-helper",
      "sha256": "51678183f46cf73309874f944d2c1d48598875059e5b0532f2295c6efac7ba2c"
    },
    {
      "mode": "0644",
      "path": "nxextract/vendor/python/UnityPy/classes/math.py",
      "role": "nxextract-helper",
      "sha256": "c56f585e070261d823aa5b59ee2b67243526ba9c0351e5097cdf95db3adeba7b"
    },
    {
      "mode": "0644",
      "path": "nxextract/vendor/python/UnityPy/config.py",
      "role": "nxextract-helper",
      "sha256": "f61b6631b066ef0d21feb4fb771170ca6eff0758e86968a6cb983a3b7457ee40"
    },
    {
      "mode": "0644",
      "path": "nxextract/vendor/python/UnityPy/enums/Audio.py",
      "role": "nxextract-helper",
      "sha256": "cff4a5aed2e9c0452a0ecf2c8b4651c7efa116b7fe3764513ef8c5f37693308f"
    },
    {
      "mode": "0644",
      "path": "nxextract/vendor/python/UnityPy/enums/BuildTarget.py",
      "role": "nxextract-helper",
      "sha256": "a2e54831f8cde23bb2516a45df856ced002d41da72f1d0fe7c4fbd39d97f8d99"
    },
    {
      "mode": "0644",
      "path": "nxextract/vendor/python/UnityPy/enums/BundleFile.py",
      "role": "nxextract-helper",
      "sha256": "c8b0baf57a8a34bd5890c42e87bd5ed6ad99960ae4a63f48c83099e085b32aa4"
    },
    {
      "mode": "0644",
      "path": "nxextract/vendor/python/UnityPy/enums/ClassIDType.py",
      "role": "nxextract-helper",
      "sha256": "dbde0ff24c1ad5fe11abdd19be2ef382cc246d912624a8ce8d91ad9dd288ac10"
    },
    {
      "mode": "0644",
      "path": "nxextract/vendor/python/UnityPy/enums/CommonString.py",
      "role": "nxextract-helper",
      "sha256": "41ff44c4c5a338e44117250737e1dcbc66cf52d92c2dd915320f57fb6e2140e5"
    },
    {
      "mode": "0644",
      "path": "nxextract/vendor/python/UnityPy/enums/ExtendableEnum.py",
      "role": "nxextract-helper",
      "sha256": "839da6a558b57a8b3cdc47fcb789d3b3a0f821fdd48a2172f348a2e57bfe5ad2"
    },
    {
      "mode": "0644",
      "path": "nxextract/vendor/python/UnityPy/enums/FileType.py",
      "role": "nxextract-helper",
      "sha256": "c6a5e4a55e068c9a8919487a5372f441023d47ab400be4892235a3320a2ee3f2"
    },
    {
      "mode": "0644",
      "path": "nxextract/vendor/python/UnityPy/enums/GfxPrimitiveType.py",
      "role": "nxextract-helper",
      "sha256": "1ea32e36d1057a998280f11043ccb60b89b3f2594477c965fe074fe2fc9e66f1"
    },
    {
      "mode": "0644",
      "path": "nxextract/vendor/python/UnityPy/enums/GraphicsFormat.py",
      "role": "nxextract-helper",
      "sha256": "120978287103acbcf2dc815f712957dd64616b409bfec15a2abbef5caeed467b"
    },
    {
      "mode": "0644",
      "path": "nxextract/vendor/python/UnityPy/enums/PassType.py",
      "role": "nxextract-helper",
      "sha256": "aa8f8307ac3242c0d6e6c6780e2c1c677e9b89999ec6ba2b84338a22e5c60074"
    },
    {
      "mode": "0644",
      "path": "nxextract/vendor/python/UnityPy/enums/SerializedPropertyType.py",
      "role": "nxextract-helper",
      "sha256": "448794bfdf5d2c9d376a54888daf88cd5288c82e5758116e2698b141458ed482"
    },
    {
      "mode": "0644",
      "path": "nxextract/vendor/python/UnityPy/enums/ShaderCompilerPlatform.py",
      "role": "nxextract-helper",
      "sha256": "c118593dee99440a5e3797511d98062adf6b07ae5b28951a9f53eaf0916e3bbb"
    },
    {
      "mode": "0644",
      "path": "nxextract/vendor/python/UnityPy/enums/ShaderGpuProgramType.py",
      "role": "nxextract-helper",
      "sha256": "deb222f00ec685e66a28028143364e348a872ed3816f605d07142111654aeeab"
    },
    {
      "mode": "0644",
      "path": "nxextract/vendor/python/UnityPy/enums/SpriteMeshType.py",
      "role": "nxextract-helper",
      "sha256": "577442f60354642eecd0a57fabd81776f34a6b9e9245665607e3882a861e8eed"
    },
    {
      "mode": "0644",
      "path": "nxextract/vendor/python/UnityPy/enums/SpritePackingMode.py",
      "role": "nxextract-helper",
      "sha256": "4897a1a5047d1bd5368c2ece378bdff352daa77881148198876632331e4d88bd"
    },
    {
      "mode": "0644",
      "path": "nxextract/vendor/python/UnityPy/enums/SpritePackingRotation.py",
      "role": "nxextract-helper",
      "sha256": "4f3684a2541d486b07e67f60c32d5621b71b9ca4f4a5fc67008fb0f28c0faf97"
    },
    {
      "mode": "0644",
      "path": "nxextract/vendor/python/UnityPy/enums/TextureDimension.py",
      "role": "nxextract-helper",
      "sha256": "22b4082805b36a134ba3af1edf74a1216e82c461b92618e9b6646e2f9e872e5f"
    },
    {
      "mode": "0644",
      "path": "nxextract/vendor/python/UnityPy/enums/TextureFormat.py",
      "role": "nxextract-helper",
      "sha256": "481d962a6cf841b926bad37e42976cded5c2a5f3514d119876922b0dbbb53b75"
    },
    {
      "mode": "0644",
      "path": "nxextract/vendor/python/UnityPy/enums/__init__.py",
      "role": "nxextract-helper",
      "sha256": "f99eaa2a3248e8f668790b71ca172b0235f315ee8bc347419ff6a9352658575c"
    },
    {
      "mode": "0644",
      "path": "nxextract/vendor/python/UnityPy/environment.py",
      "role": "nxextract-helper",
      "sha256": "57d5649da8ea62dca7a5c527cbc993375f8a96cd57ce866fd784995263f60ae7"
    },
    {
      "mode": "0644",
      "path": "nxextract/vendor/python/UnityPy/exceptions.py",
      "role": "nxextract-helper",
      "sha256": "7b9a556598a18502a60c1140cdb72d436d4ca6b2815d63064ee91675f9ee7708"
    },
    {
      "mode": "0644",
      "path": "nxextract/vendor/python/UnityPy/files/BundleFile.py",
      "role": "nxextract-helper",
      "sha256": "7aaa2ce223c3a2c49c899a4a4fca772934e8c737f63c225e373296ce685e8312"
    },
    {
      "mode": "0644",
      "path": "nxextract/vendor/python/UnityPy/files/File.py",
      "role": "nxextract-helper",
      "sha256": "92a10d45456820228bbd4c9c0bdbf251722649058ac2306d59e4add70d331bf2"
    },
    {
      "mode": "0644",
      "path": "nxextract/vendor/python/UnityPy/files/ObjectReader.py",
      "role": "nxextract-helper",
      "sha256": "16a8c79d29b6efdc5773805e958ccb60870812a54d8f26e2180bc78169fc2fbe"
    },
    {
      "mode": "0644",
      "path": "nxextract/vendor/python/UnityPy/files/SerializedFile.py",
      "role": "nxextract-helper",
      "sha256": "32f5ad9e7463e6fb1c02d1c3ef3481ee2640b123533b96d9ad579ae946596b6b"
    },
    {
      "mode": "0644",